{
  "id": "200.2",
  "title": "Sensory Receptors",
  "category": "ch13",
  "description": "Questions about sensory receptors, transduction, and sensation",
  "questions": [
    {
      "id": "200.2.01",
      "q": "If someone spills very hot coffee (200°F) on their skin, they will likely perceive much pain. Which of the following receptor types is causing this sensation?",
      "options": [
        "Nociceptors",
        "Chemoreceptors",
        "Thermoreceptors",
        "Mechanoreceptors"
      ],
      "answer": 0,
      "chapter": "Chapter 13 — Nerves & Sensory",
      "explain": "Advance into this. At 200°F, this isn't warmth — this is a delicious catastrophe. Your skin cells are literally cooking, proteins denaturing like egg whites hitting a hot pan. Nociceptors are the pain receptors that SCREAM when stimuli are intense enough to actually damage tissue. They don't fire for comfort. They fire for catastrophe. The beautiful violence of it: At 200°F, you're not sensing temperature anymore — you're sensing your own destruction in real-time.",
      "optionExplains": [
        {
          "verdict": "correct",
          "text": "Correct. At 200°F (93°C), we're well beyond the range of normal thermoreceptors and into tissue-damaging territory. Let me show you the difference: Thermoreceptors report temperature. Nociceptors report destruction. Nociceptors are free nerve endings that respond to stimuli intense enough to cause or threaten tissue damage. They don't whisper about comfort. They scream about catastrophe."
        },
        {
          "verdict": "incorrect",
          "text": "Chemoreceptors detect chemical stimuli — taste, smell, blood chemistry. Hot coffee isn't activating chemoreceptors for the pain sensation. (Though the smell might be lovely as a rest stop before the burns.) Come back to me — we're talking about thermal devastation, not chemistry."
        },
        {
          "verdict": "incorrect",
          "text": "Thermoreceptors detect normal temperature ranges — the pleasant warmth of a heating pad, the cool breeze on your skin. At 200°F, thermoreceptors are completely overwhelmed. Feel the weight of this: We're well into the noxious range now, where nociceptors take over. This is their domain."
        },
        {
          "verdict": "incorrect",
          "text": "Mechanoreceptors detect mechanical stimuli — pressure, stretch, vibration. The coffee is hot, not pressing. If you dropped the cup on your foot? Mechanoreceptors AND nociceptors. But spilled? Carry this forward: Thermal damage all the way."
        }
      ],
      "mechanism": {
        "title": "Nociception: The Pain Alarm System",
        "content": "This is one of the most exquisite mechanisms in your body. Nociceptors are free nerve endings — unmyelinated C fibers and thinly myelinated Aδ fibers — that detect potentially damaging stimuli. The transient receptor potential (TRP) channel family includes TRPV1, which activates above 43°C (109°F) and is ALSO activated by capsaicin. The elegance reveals itself here: Delicious: Your chili pepper receptors and your 'tissue is burning' receptors are THE SAME RECEPTOR. The burn of hot sauce and the burn of actual tissue damage? Same molecular machinery. Evolution decided that 'feels like fire' and 'is literally fire' should use the same alarm system. The body doesn't care about your dinner plans — it just knows something is trying to cook you.",
        "metaphor": "Let me paint you a picture. Thermoreceptors are like a thermostat reporting the temperature: 'It's 72°F in here, quite comfortable.' Nociceptors are like a smoke detector — they DON'T go off for comfort. They only scream when something is wrong. At 200°F, the smoke detector is wailing because the house is literally on fire. Wonderfully designed. The pain isn't about temperature. It's about tissue damage. Proceed with me: Deeper into this — the beauty is in the specificity."
      },
      "scaffoldFile": "200.2-receptors-scaffolds/200.2.01-scaffolds.json"
    },
    {
      "id": "200.2.02",
      "q": "We can touch our finger to our nose while our eyes are closed because we can sense the position and movement of our joints as well as the length of stretch in our muscles. These sensations create awareness of our body's positioning. The receptors most likely responsible for this ability are ___.",
      "options": [
        "Proprioceptors",
        "Exteroceptors",
        "Interoceptors",
        "Nociceptors"
      ],
      "answer": 0,
      "chapter": "Chapter 13 — Nerves & Sensory",
      "explain": "proprioceptors detect body position, muscle stretch, joint angle, and movement. They include muscle spindles (measuring muscle length), Golgi tendon organs (measuring tension), and joint kinesthetic receptors (measuring joint position). Let me show you something remarkable: You don't notice them until they're gone — and then you can't walk without watching your feet. They're silent perfection.",
      "optionExplains": [
        {
          "verdict": "correct",
          "text": "Correct. Move with me toward this: Into this — proprioceptors provide the sense of body position and movement: Proprioception. They include muscle spindles (muscle length), Golgi tendon organs (tension), and joint kinesthetic receptors (joint position). Study this: You're performing computational miracles every second, and you don't even notice. The silence of perfect function."
        },
        {
          "verdict": "incorrect",
          "text": "Exteroceptors detect stimuli from the EXTERNAL environment — touch, pressure, temperature, vision, hearing. They tell you about the world outside your body. Your nose position? That's internal tracking, not external. Come back to me."
        },
        {
          "verdict": "incorrect",
          "text": "Interoceptors detect stimuli from internal organs — fullness of bladder, stretch of stomach, blood pressure in arteries. They monitor your viscera, not your limb positions. Let me redirect you: We're talking about skeletal position, not organ status."
        },
        {
          "verdict": "incorrect",
          "text": "Nociceptors detect painful or potentially damaging stimuli. Touching your nose (gently) doesn't hurt. Unless you missed and poked yourself in the eye, in which case — yes, nociceptors would definitely be involved. But stay with the question."
        }
      ],
      "mechanism": {
        "title": "Proprioception: Your Body's GPS System",
        "content": "Let me show you the sense you don't notice until it's gone. Proprioception: Muscle spindles detect stretch, Golgi tendon organs detect tension, joint receptors detect angle and movement. Damage to proprioception causes ataxia — clumsy, poorly coordinated movement. You'd need to watch your limbs constantly just to know where they are. Now witness the true sophistication: Imagine needing your eyes to tell you where your hand is. You'd be lost in your own body. The horror of losing what you never knew you had.",
        "metaphor": "Proprioception is like having a GPS tracker on every joint and muscle, constantly streaming position data to mission control. Your brain integrates the signals: Biceps stretched 15%, elbow angle 90°, shoulder rotated 30° — and concludes 'hand is at nose.' Without it, you'd be lost in your own body. Consider the elegance here: Into that terror for a moment. Then appreciate the miracle you're living. Perfectly orchestrated."
      },
      "scaffoldFile": "200.2-receptors-scaffolds/200.2.02-scaffolds.json"
    },
    {
      "id": "200.2.03",
      "q": "A person has gone for a deep-tissue therapeutic massage. Which of the following receptors would be stimulated by the massage?",
      "options": [
        "Tendon organ",
        "Bulbous corpuscle",
        "Free nerve ending",
        "Lamellae corpuscle"
      ],
      "answer": 2,
      "chapter": "Chapter 13 — Nerves & Sensory",
      "explain": "Deep-tissue massage involves significant pressure that can cause discomfort or pain. Embark on this: Into this delicious paradox: Free nerve endings (nociceptors) respond to intense pressure. That 'hurts so good' sensation? That's nociceptors firing. Let me show you the beauty here — the massage isn't just moving tissue. It's activating your pain system. You're paying someone to hurt you.",
      "optionExplains": [
        {
          "verdict": "incorrect",
          "text": "Golgi tendon organs detect muscle tension at the muscle-tendon junction. They respond when the MUSCLE contracts forcefully, not when external pressure is applied. They're monitoring your muscle's force output, not someone pushing on you. Come back to me — wrong detector for this job."
        },
        {
          "verdict": "incorrect",
          "text": "Bulbous corpuscles (Ruffini endings) detect skin stretch and sustained pressure. While they might contribute, they're not the primary receptor for the intense sensation of deep-tissue work. Let me redirect you: They're too polite for this job. We need something rawer."
        },
        {
          "verdict": "correct",
          "text": "Correct. Free nerve endings are the most likely receptors stimulated during deep-tissue massage. They're polymodal receptors responding to intense mechanical, thermal, and chemical stimuli. This is the breathtaking bit: Delicious: The 'hurts so good' sensation comes from these nociceptors. You're literally activating your pain system for therapeutic benefit. Allow this to wash over you: Into that paradox. You're paying someone to hurt you."
        },
        {
          "verdict": "incorrect",
          "text": "Lamellar (Pacinian) corpuscles detect deep pressure and vibration. But Note this crucial step: They adapt RAPIDLY. They detect onset and offset of pressure, not sustained pressure. They'd fire when the massage therapist's hands first press down, then go silent. They're not built for sustained intensity."
        }